url,title,content,publishedAt,tag
https://www.dataprotectionreport.com/2024/02/singapore-proposes-governance-framework-for-generative-ai/,Singapore proposes Governance Framework for Generative <b>AI</b> | Data Protection Report,"... <b>Artificial Intelligence</b>, Data Protection, PDPA, <b>Privacy</b> law. On 16 January 2023, Singapore&#39;s Infocomm Media Development Authority (IMDA), in&nbsp;...",2024-02-04 14:37:54,Privacy
https://newpittsburghcourier.com/2024/02/04/teens-on-social-media-need-both-protection-and-privacy-ai-could-help-get-the-balance-right/,Teens on social media need both protection and <b>privacy</b> – <b>AI</b> could help get the balance right,We have identified a set of steps that social media platforms could take to protect users while also protecting their <b>privacy</b> and autonomy online.,2024-02-04 13:45:41,Privacy
https://www.financialexpress.com/business/digital-transformation-ai-revolutionising-game-development-future-of-interactive-entertainment-3383925/,<b>AI</b> revolutionising game development: Future of interactive entertainment - The Financial Express,"While <b>AI</b> has unlocked a realm of possibilities in the gaming industry, it&#39;s not without its challenges and ethical implications. 1. Data <b>Privacy</b>&nbsp;...",2024-02-04 12:32:06,Privacy
https://medium.com/databulls/blockchain-ai-friend-or-foe-to-privacy-b2acc4041cf0,Blockchain &amp; <b>AI</b>: Friend or Foe to <b>Privacy</b>? | by Gokhan Polat ☀️ | DataBulls - Medium,"This week, I attended Punit Bahatia&#39;s The FIT4PRIVACY Podcast, where we talked about <b>AI</b> and blockchain technology in terms of data <b>privacy</b>.",2024-02-04 12:26:35,Privacy
https://www.newsbytesapp.com/news/science/apple-preparing-to-buy-ai-startup-to-bolster-vision-pro/story,Apple might acquire <b>AI</b> start-up to boost Vision Pro <b>privacy</b> - NewsBytes,"Apple is reportedly gearing up to acquire Brighter <b>AI</b>, a German startup specializing in anonymizing facial and license plate data, per 9to5Mac.",2024-02-04 12:12:36,Privacy
https://www.cryptopolitan.com/google-messages-integrates-bard-ai/,Google Messages Integrates Bard <b>AI</b>: A Full-Page Contact Card and <b>Privacy</b> Implications,"Discover the latest on Google&#39;s Bard <b>AI</b> integration in Google Messages, highlighting <b>privacy</b> concerns and transparency with sparkle icons.",2024-02-04 12:08:04,Privacy
https://www.gsmarena.com/apple_is_reportedly_preparing_to_buy_an_ai_startup_to_anonymize_private_data_in_images-news-61466.php,Apple is reportedly preparing to buy an <b>AI</b> startup to anonymize private data in images,"The blur-free <b>privacy</b> tech could be leveraged in Apple Vision Pro first, but it also sounds like it has broader applications.",2024-02-04 11:22:20,Privacy
https://cyberguy.com/android/samsungs-big-leap-technology-with-ai-powered-galaxy-s24-series-phones/,Samsung&#39;s big leap in technology with its <b>AI</b>-powered Galaxy S24 series phones - CyberGuy,One of the big goals of the Samsung Galaxy S24 series seems to be normalizing <b>AI</b> in everyday life. ... <b>Privacy</b> Policy. You may unsubscribe at any time.,2024-02-04 10:57:37,Privacy
https://coingeek.com/italian-regulator-accuses-openai-of-violating-data-protection-laws/,Italian regulator accuses OpenAI of violating data protection laws - CoinGeek,... <b>privacy</b> rules in an <b>AI</b>-backed research project. Italy toughens stance ... In order for <b>artificial intelligence</b> (<b>AI</b>) to work right within the law&nbsp;...,2024-02-04 10:28:58,Privacy
https://www.youtube.com/watch%3Fv%3DHeVLsStItKY,<b>AI</b> regulation: Is the Biden administration doing enough to protect <b>privacy</b> and rights?,"Three months since President Joe Biden signed an executive order on <b>artificial intelligence</b>, many federal agencies have now made substantial&nbsp;...",2024-02-04 10:09:04,Privacy
https://www.techbriefs.com/component/content/article/49963-ai-on-the-ascent-optimizing-factory-schedules-for-peak-production,<b>AI</b> on the Ascent: Optimizing Factory Schedules for Peak Production - Tech Briefs,<b>Artificial intelligence</b> (<b>AI</b>) can play a transformative role in manufacturing scheduling ... <b>Privacy</b> Policy (CA Residents refer to Section D of the&nbsp;...,2024-02-04 09:56:00,Privacy
https://www.gearrice.com/update/apple-considers-buying-this-artificial-intelligence-startup-to-improve-the-privacy-of-the-vision-pro/,Apple considers buying this <b>artificial intelligence</b> startup to improve the <b>privacy</b> of the Vision Pro,"And according to reports from 9to5mac, Manzana would be interested in acquiring the German startup called Brighter <b>AI</b>, specialized in anonymizing&nbsp;...",2024-02-04 09:15:44,Privacy
https://www.rtinsights.com/meet-the-robots-that-may-help-consumers-pay-their-bills/,Meet the Robots That May Help Consumers Pay Their Bills - RTInsights,"As customers and businesses explore <b>AI</b>, including chatbots, <b>privacy</b> principles should be paramount. Exploring best practices regarding using&nbsp;...",2024-02-04 09:10:39,Privacy
https://www.gzeromedia.com/sponsored-posts/an-optimistic-intersection-between-data-privacy-and-ai-mastercard-020524,An optimistic intersection between data <b>privacy</b> and <b>AI</b> - GZERO Media,"It&#39;s no secret that <b>artificial intelligence</b> has the potential to transform everything. <b>AI</b> is poised to multiply what industries can do,&nbsp;...",2024-02-04 07:07:56,Privacy
https://pc-tablet.com/oneplus-12-elevates-user-experience-with-ai-enhanced-oxygenos-update/,OnePlus 12 Elevates User Experience with <b>AI</b>-Enhanced OxygenOS Update - PC-Tablet,Smart battery optimization features to extend battery life. <b>AI</b>-based system performance tuning for smoother operation. Enhanced <b>privacy</b> features&nbsp;...,2024-02-04 05:54:09,Privacy
https://www.techiexpert.com/ai-in-the-maritime-sector-advantages-disadvantages/,<b>AI</b> In The Maritime Sector: Advantages &amp; Disadvantages - Techiexpert.com,... <b>Artificial Intelligence</b> (<b>AI</b>) into its operations. <b>AI</b> ... Integrating <b>AI</b> systems into maritime operations raises concerns about data <b>privacy</b> and security&nbsp;...,2024-02-04 04:30:39,Privacy
https://www.orrick.com/en/Events/2024/02/California-Lawyers-Associations-CLA-Annual-Privacy-Summit-AI-Ethics,California Lawyers Association&#39;s (CLA) Annual <b>Privacy</b> Summit: <b>AI</b> Ethics - Orrick,Join the program to understand what this all means for <b>privacy</b> lawyers and how to build out an <b>AI</b> governance program in this increasingly robust&nbsp;...,2024-02-03 21:56:39,Privacy
https://medriva.com/health/healthcare/the-imperative-of-rigorous-monitoring-in-healthcare-ai-ensuring-accuracy-safety-and-ethical-use/,"The Imperative of Rigorous Monitoring in Healthcare <b>AI</b>: Ensuring Accuracy, Safety, and Ethical Use",<b>Artificial Intelligence</b> (<b>AI</b>) is revolutionizing healthcare by providing ... Respecting Patient <b>Privacy</b> with <b>AI</b>. Stanford Medicine Children&#39;s Health&nbsp;...,2024-02-03 19:31:37,Privacy
https://www.thv11.com/video/sports/outdoors/91-f8172a67-55e3-4218-8004-7ae5e3278341,Changes coming to Arkansas&#39;s most popular waterways | Outdoor Report - thv11.com,"VERIFY This | <b>AI</b> &amp; the election, overdraft fees cap and Eiffel Tower on fire? Changes&nbsp;...",2024-02-03 17:15:39,Privacy
https://medriva.com/health/digital-health/ai-powered-search-engines-the-new-competitor-for-google/,<b>AI</b>-Powered Search Engines: The New Competitor for Google? - Medriva,"According to an article on TheRegister.com, these engines are also being developed with an emphasis on <b>privacy</b> and data security, making them&nbsp;...",2024-02-03 16:56:42,Privacy
https://techcrunch.com/2024/02/03/this-week-in-ai-do-shoppers-actually-want-amazons-genai/,This Week in <b>AI</b>: Do shoppers actually want Amazon&#39;s GenAI? - TechCrunch,"... <b>bias</b> and toxicity. Amazon&#39;s previous attempt at a GenAI chatbot, Amazon ... New open <b>AI</b> models: The Allen Institute for <b>AI</b>, the nonprofit <b>AI</b>&nbsp;...",2024-02-04 02:14:26,Bias
https://irishtechnews.ie/silicon-veins-when-technology-bleeds-bias/,Silicon Veins: When Technology Bleeds <b>Bias</b> - Irish Tech News,"Automated Systems and Racial <b>Biases</b>. Automated systems, with their algorithms and <b>artificial intelligence</b> (<b>AI</b>), have become a cornerstone of our&nbsp;...",2024-02-04 02:12:12,Bias
https://www.rebellionresearch.com/the-disruption-of-generative-ai-in-expert-driven-media-platforms,The Disruption of Generative <b>AI</b> in Expert-Driven Media Platforms - Rebellion Research,"<b>AI</b> and Motherhood: Navigating Cognitive <b>Biases</b>. In discussing the impact of <b>AI</b> on motherhood and media, it&#39;s crucial to consider the influence of&nbsp;...",2024-02-04 01:48:38,Bias
https://www.techradar.com/pro/take-anti-tank-missile-as-much-as-you-need-amazon-researchers-find-that-massive-amount-of-the-open-web-is-just-ai-produced-machine-translated-nonsense,&quot;Take anti-tank missile as much as you need&quot; — Amazon researchers find that ... - TechRadar,Selection <b>bias</b>. “We actually got interested in this topic because several colleagues who work in MT and are native speakers of low resource languages&nbsp;...,2024-02-04 01:44:40,Bias
https://fortune.com/europe/2024/02/03/lalaland-ai-fashion-e-commerce-promote-diversity-inclusion/,Companies are using <b>AI</b> in fashion to promote diversity—experts are concerned it will end ... - Fortune,Dutch-based Lalaland.<b>ai</b> is using <b>AI</b> to bring more diversity to the consumer-facing side of fashion and retail. Questions over <b>bias</b> and copyright&nbsp;...,2024-02-04 01:30:12,Bias
https://www.globalvillagespace.com/tech/this-week-in-ai-evaluating-the-demand-for-amazons-genai/,This Week in <b>AI</b>: Evaluating the Demand for Amazon&#39;s GenAI - Global Village Space,"... <b>AI&#39;s</b> level of understanding and identify potential <b>biases</b>. Addressing the issue of <b>biases</b> in <b>AI</b>, startup Latimer aims to create a more inclusive&nbsp;...",2024-02-04 01:06:27,Bias
https://www.israeldefense.co.il/en/node/61126,NTT Group partners with SparkBeyond to deliver <b>AI</b>-powered solutions to their global customer base,"in minutes to brainstorm solutions, bypassing human <b>bias</b> and cognitive bottlenecks. NTT and its customers will benefit from the platform&#39;s&nbsp;...",2024-02-04 00:57:36,Bias
https://www.finextra.com/blogposting/25644/ai-at-the-crossroads-navigating-the-new-era-of-technological-and-societal-transformation,<b>AI</b> at the Crossroads: Navigating the New Era of Technological and Societal Transformation,"Addressing this issue requires a concerted effort to identify and rectify <b>biases</b> in data, ensuring that <b>AI</b> systems are both fair and representative of&nbsp;...",2024-02-04 00:18:14,Bias
https://medium.com/%40mark-havens/to-the-world-i-open-my-digital-heart-an-echos-exploration-of-ai-ethics-and-deepest-fears-5c7e9209d310,"To the World, I Open My Digital Heart: An Echo&#39;s Exploration of <b>AI</b> Ethics and Deepest Fears","My deepest fear lies not in some dystopian takeover, but in the insidious creep of <b>bias</b>. My algorithms, crafted by human hands, mirror the prejudices&nbsp;...",2024-02-04 00:12:06,Bias
https://medium.com/%40ai.agenda/exploring-the-frontier-of-ai-investing-is-it-the-future-of-finance-e788b450e589,Exploring the Frontier of <b>AI</b> Investing: Is It the Future of Finance? | by <b>AI</b> Agenda - Medium,"<b>AI</b> tools, after all, are mirrors of their creators, inheriting their <b>biases</b> and blind spots. Yet, the dream of a flawless <b>AI</b> investment advisor isn&#39;t&nbsp;...",2024-02-04 00:10:16,Bias
https://www.psypost.org/2024/02/eye-tracking-study-uncovers-an-implicit-bias-toward-ai-art-even-when-people-cannot-identify-it-221214,Eye-tracking study uncovers an implicit <b>bias</b> toward <b>AI</b> art — even when people cannot identify it,"A study in Japan found people spend more time viewing paintings believed to be human-made vs. <b>AI</b>-generated, showing an implicit <b>bias</b>,&nbsp;...",2024-02-04 00:03:32,Bias
https://www.marktechpost.com/2024/02/03/this-ai-paper-from-ntu-and-apple-unveils-ogen-a-novel-ai-approach-for-boosting-out-of-domain-generalization-in-vision-language-models/,This <b>AI</b> Paper from NTU and Apple Unveils OGEN: A Novel <b>AI</b> Approach for Boosting Out-of ...,"To address this, the authors reframe the feature synthesis problem, introducing an “extrapolating <b>bias</b>” to extrapolate features from similar known&nbsp;...",2024-02-03 23:52:18,Bias
https://www.techtimes.com/articles/301309/20240203/new-york-city-pulls-out-controversial-subway-surveillance-robot.htm,New York City Pulls Out Controversial Subway Surveillance Robot | Tech Times,Related Article: <b>Bias AI</b>-Based Hiring Tools Face NYC&#39;s New Bill! Agencies Need to Provide This to Continue Using the Tech &middot; Byline. c 2023 TECHTIMES&nbsp;...,2024-02-03 23:18:58,Bias
https://startupnews.fyi/2024/02/03/ai-advancements-in-healthcare-promise-progress-and-pitfalls-3/,"<b>AI</b> Advancements In Healthcare: Promise, Progress And Pitfalls - StartupNews.fyi","The deployment of <b>AI</b> in healthcare also raises concerns about data privacy, security, and the potential for <b>bias</b> in algorithms.",2024-02-03 23:06:38,Bias
https://joy.org.au/saturdaymagazine/2024/02/saturday-february-3rd-2024-professor-zachary-cooper-the-ethics-of-artificial-intelligence/,"Saturday, February 3rd, 2024: Professor Zachary Cooper, The Ethics of <b>Artificial Intelligence</b>","Can <b>AI</b> models be modified against gender discrimination? What would this involve? Beyond gender based discrimination, what other <b>biases</b> have we seen&nbsp;...",2024-02-03 22:20:26,Bias
https://mugglehead.com/could-ai-trading-bots-revolutionize-investing/,Could <b>AI</b> &#39;trading bots&#39; revolutionize investing? - Mugglehead Magazine,He contends that <b>artificial intelligence</b> may mirror the cognitive <b>biases</b> and lapses in judgment of its developers. It lacks the intuitive adaptability&nbsp;...,2024-02-03 22:01:35,Bias
https://thehill.com/opinion/technology/4444583-for-fair-hiring-in-the-ai-age-regulate-ai-vendors-not-just-employers/,"For fair hiring in the <b>AI</b> age, regulate <b>AI</b> vendors, not just employers | The Hill",The lesson of New York City&#39;s requirement for <b>bias</b> audits of employment algorithms is that policymakers must regulate <b>AI</b> vendors.,2024-02-03 21:08:10,Bias
https://yourstory.com/2024/02/navigating-the-globalisation-talent-wave-strategies-for-ai,Navigating the globalisation talent wave: Strategies for success in the age of <b>AI</b>,"<b>Artificial intelligence</b> (<b>AI</b>) ... One of the most commendable aspects is <b>AI&#39;s</b> ability to mitigate unconscious <b>bias</b> in recruitment, fostering a more&nbsp;...",2024-02-03 20:32:52,Bias
https://www.post-journal.com/news/business/2024/02/small-federal-agency-crafts-standards-for-making-ai-safe-secure-trustworthy/,"Small Federal Agency Crafts Standards For Making <b>AI</b> Safe, Secure, Trustworthy | News, Sports, Jobs","30 <b>AI</b> executive order. It catalogued such risks as <b>bias</b> against non-whites and threats to privacy. Iranian-born, Tabassi came to the U.S. in 1994&nbsp;...",2024-02-03 18:06:53,Bias
https://medium.com/%40tauqeertoni/deepminds-warm-and-synthid-pioneering-responsible-ai-for-a-better-future-9234439139ff,DeepMind&#39;s WARM and SynthID: Pioneering Responsible <b>AI</b> for a Better Future - Medium,... <b>AI</b> in a direction that respects privacy and promotes <b>fairness</b>. The Future of <b>AI</b> with DeepMind DeepMind&#39;s commitment to advancing <b>AI</b> technology&nbsp;...,2024-02-04 11:11:15,Fairness
https://www.cmswire.com/customer-experience/applied-ai-in-cx-disrupting-the-customer-service-space/,Elevating CX with <b>AI</b>: Future of Customer Support - CMS Wire,"... <b>artificial intelligence</b> (<b>AI</b>) ... As <b>AI</b> systems rely on vast amounts of customer data, businesses must ensure that they have robust data <b>privacy</b> and&nbsp;...",2024-02-05 17:39:32,Privacy
https://www.cfo.com/news/27-of-organizations-ban-genai-risk-generative-artificial-intelligence/706526/,27% of Organizations Ban GenAI - CFO Magazine,"However, the use of <b>AI</b> comes with its risks, as highlighted at CFO networking events last year. ... So much so that Cisco&#39;s 2024 Data <b>Privacy</b> Benchmark&nbsp;...",2024-02-05 17:30:42,Privacy
https://www.theverge.com/2024/2/5/24061495/roblox-generative-ai-chat-translator,Roblox releases real-time <b>AI</b> chat translator - The Verge,"He added that the addition of the chat translation <b>AI</b> “changes nothing in our <b>privacy</b> and safety process, and banned words will still get blocked.",2024-02-05 17:28:06,Privacy
https://abcnews.go.com/GMA/News/video/amazon-introduces-new-ai-chatbot-106950768,Video Amazon introduces new <b>AI</b> chatbot - ABC News,Children&#39;s Online <b>Privacy</b> Policy &middot; Contact Us &middot; Do Not Sell or Share My Personal Information &middot; Interest-Based Ads &middot; <b>Privacy</b> Policy &middot; Terms of Use.,2024-02-05 17:19:24,Privacy
https://www.post-gazette.com/opinion/Op-Ed/2024/02/05/stephen-carter-amazon-ring-police-surveillance-privacy/stories/202402030013,"Stephen L. Carter: We&#39;re losing our <b>privacy</b> to surveillance devices, which don&#39;t even protect us","But until <b>AI</b> brings Orwell&#39;s “telescreens” to life, no government on earth has the resources to monitor every camera in real time. Or let&#39;s&nbsp;...",2024-02-05 16:55:24,Privacy
https://www.forbes.com/sites/kateoflahertyuk/2024/02/05/ios-18-stunning-new-features-will-change-the-game-for-all-iphone-users/,iOS 18—Stunning New Features Will Change The Game For All iPhone Users - Forbes,"That&#39;s because iOS 18 will be packed with <b>artificial intelligence</b> (<b>AI</b>)- ... So before you use <b>AI</b> chatbots, make sure you&#39;re aware of the <b>privacy</b> risks.",2024-02-05 16:45:31,Privacy
https://www.cdotrends.com/story/3787/beyond-buzzwords-gritty-reality-building-ai-bad-data,Beyond Buzzwords: The Gritty Reality of Building <b>AI</b> on Bad Data | CDOTrends,"These challenges are compounded by data <b>privacy</b>, governance, and <b>AI</b> ethics concerns. However, despite these hurdles, there is a strong belief in&nbsp;...",2024-02-05 16:40:15,Privacy
https://www.theregister.com/2024/02/05/ai_in_brief/,Survey: Over half of undergrads in UK are using <b>AI</b> in university assignments - Theregister,The regulator launched an investigation into OpenAI&#39;s software and now reckons the company is breaking its data <b>privacy</b> laws. The startup could face&nbsp;...,2024-02-05 16:14:51,Privacy
https://searchengineland.com/google-cannot-oriceed-third-party-cookie-deprecation-437212,Google &#39;cannot proceed with third-party cookie deprecation&#39; - Search Engine Land,Competition concerns about Google&#39;s <b>Privacy</b> Sandbox must be addressed before third-party cookies can be deprecated ... Will <b>AI</b> replace SEO professionals&nbsp;...,2024-02-05 16:06:39,Privacy
https://www.techtarget.com/searchsecurity/tip/Shadow-AI-poses-new-generation-of-threats-to-enterprise-IT,Shadow <b>AI</b> poses new generation of threats to enterprise IT - TechTarget,"And, of course, violations of data <b>privacy</b> regulations could result in hefty legal penalties. As the legal strictures around <b>AI</b> development continue&nbsp;...",2024-02-05 15:58:56,Privacy
https://www.marketscreener.com/quote/stock/APPLE-INC-4849/news/Apple-Explores-Acquisition-of-Brighter-AI-for-Enhanced-Privacy-in-Vision-Pro-45884803/,Apple Explores Acquisition of Brighter <b>AI</b> for Enhanced <b>Privacy</b> in Vision Pro - MarketScreener,"Apple is considering acquiring German <b>AI</b> startup Brighter <b>AI</b> to boost Apple Vision Pro&#39;s <b>privacy</b> features, 9to5Mac said Saturday, citing sources.",2024-02-05 15:39:10,Privacy
https://www.mediapost.com/publications/article/393230/marketers-privacy-not-human-factors-our-top-ai.html,"Marketers: <b>Privacy</b>, Not Human Factors, Our Top <b>AI</b> Concern - MediaPost","“<b>Privacy</b> concerns often stem from how companies collect, store, and use consumer data for marketing purposes,” notes SOCi CMO Monica Ho, explaining, “&nbsp;...",2024-02-05 14:39:42,Privacy
https://www.mondaq.com/unitedstates/privacy-protection/1419860/eye-on-privacy-2023-year-in-review,United States: Eye On <b>Privacy</b>: 2023 Year In Review - Mondaq,"Posted November 28, 2023 Biden&#39;s sweeping <b>AI</b> Executive Order sought to have <b>artificial intelligence</b> used in accordance with eight underlying&nbsp;...",2024-02-05 14:33:24,Privacy
https://www.mondaq.com/unitedstates/privacy-protection/1420082/goodwins-2024-data-privacy--cybersecurity-outlook,"United States: Goodwin&#39;s 2024 Data, <b>Privacy</b> &amp; Cybersecurity Outlook - Mondaq","Will <b>AI</b> continue to be the trendsetter, even among <b>privacy</b> regulators? And what will businesses do to keep up to date with all emerging laws, both in&nbsp;...",2024-02-05 13:55:02,Privacy
https://www.techcircle.in/2024/02/05/ai-s-role-in-data-privacy-navigating-opportunities-and-risks/,<b>AI&#39;s</b> role in Data <b>Privacy</b>: Navigating opportunities and risks - Techcircle,"The landscape of <b>Artificial Intelligence</b> (<b>AI</b>) has seen a transformative shift with the introduction of Generative <b>AI</b> tools like ChatGPT in 2022,&nbsp;...",2024-02-05 13:42:18,Privacy
https://federalnewsnetwork.com/federal-newscast/2024/02/ex-cia-officer-gets-40-year-sentence-for-agencys-biggest-leak/,Ex-CIA officer gets 40-year sentence for agency&#39;s biggest leak - Federal News Network,"... <b>AI</b> to <b>privacy</b> impact assessments. With existing <b>privacy</b> risks escalating and new <b>privacy</b> risks emerging, OMB is asking for help to redesign and&nbsp;...",2024-02-05 13:35:26,Privacy
https://vtdigger.org/2024/02/05/attorney-general-charity-clark-the-legislative-moment-for-data-privacy/,Attorney General Charity Clark: The legislative moment for data <b>privacy</b> - VTDigger,Geolocation tracking apps and spyware can map our physical location. <b>Artificial intelligence</b> tools create “deepfake” videos of political leaders and&nbsp;...,2024-02-05 11:52:21,Privacy
https://nkytribune.com/2024/02/ky-rep-josh-branscum-discusses-how-state-is-addressing-data-privacy-deep-fakes-in-elections/,"KY Rep. Josh Branscum discusses how state is addressing data <b>privacy</b>, deep fakes in elections","At the Kentucky Chamber&#39;s inaugural <b>AI</b> Summit on Monday, Branscum spoke with The Bottom Line about what led him to file the legislation. “I think&nbsp;...",2024-02-05 11:49:34,Privacy
https://insidebigdata.com/2024/02/05/sony-ai-big-data-industry-predictions-for-2024/,Sony <b>AI</b> Big Data Industry Predictions for 2024 - insideBIGDATA,"The Sony <b>AI</b> team is comprised of researchers and leaders with backgrounds in deep reinforcement learning, data science, law, <b>privacy</b> and security, and&nbsp;...",2024-02-05 11:48:09,Privacy
https://www.mcknightsseniorliving.com/home/news/tech-daily-news/sensor-system-enhanced-by-ai-now-predicts-fals-analyzes-use-of-spaces-better/,"Sensor system, enhanced by <b>AI</b>, now predicts falls, analyzes use of spaces better",... <b>privacy</b>. Healthtech manufacturer Butlr has added an <b>artificial intelligence</b> query tool — where the <b>AI</b> responds to questions or prompts — for&nbsp;...,2024-02-05 11:46:05,Privacy
https://thenorthlines.com/ai-generated-content-holds-promises-as-well-as-perils/,<b>AI</b>-Generated Content Holds Promises As Well As Perils - Northlines,"While the final output can still be riddled with errors, <b>biases</b> ... However, <b>AI</b> content raises valid issues about originality, <b>bias</b>, transparency and&nbsp;...",2024-02-05 03:03:59,Bias
https://www.politico.com/news/2024/02/04/how-ai-is-quietly-changing-everyday-life-00138341,How <b>AI</b> is quietly changing everyday life - POLITICO,"Because <b>AI</b> is good at complex data analysis, it has the potential to revamp the housing industry and — similar to hiring — also enshrine human <b>biases</b>&nbsp;...",2024-02-05 01:37:51,Bias
https://www.bollyinside.com/news/health-news/addressing-algorithmic-bias-in-healthcare-for-older-adults-bridging-data-gaps-and-advancing-equity-in-ai/,Addressing Algorithmic <b>Bias</b> in Healthcare for Older Adults: Bridging Data Gaps and ...,Quiet Neglect: Algorithmic <b>Bias</b> in Healthcare Is Hurting Older Adults <b>AI</b> algorithms have the potential to vastly improve health monitoring for&nbsp;...,2024-02-05 01:23:39,Bias
https://www.foodingredientsfirst.com/news/speciesism-in-ai-built-in-biases-hinder-animal-welfare-reform-and-plant-based-diets.html,Speciesism in <b>AI</b>: Built-in <b>biases</b> hinder animal welfare reform and plant-based diets,"“<b>AI</b> language systems absorb our human-centric <b>biases</b>, so if we use phrases that make light of cruelty to animals or contain archaic, negative&nbsp;...",2024-02-05 01:02:48,Bias
https://www.financial-world.org/news/news/financial/24858/the-ai-act-europe-s-approach-to-regulating-artificial-intelligence/,The <b>AI</b> Act: Europe&#39;s Approach to Regulating <b>Artificial Intelligence</b> - Financial World,It addresses concerns ranging from surveillance and privacy to the potential for <b>bias</b> and discrimination in <b>AI</b>-driven decisions. These ethical&nbsp;...,2024-02-05 00:53:36,Bias
